{
  "version": 0,
  "instance": {
    "evm_chain_id": 2124,
    "bft_chain_id": "noortrace-2124-dev",
    "genesis_sha256": "0x510e24e41cc401faa4e092338060cee0dc4629e5781a69af7a50b37edb6f4537",
    "contracts": {
      "curator_set_registry": "0x172076e0166d1f9cc711c77adf8488051744980c",
      "recorder_registry": "0xbec49fa140acaa83533fb00a2bb19bddd0290f25",
      "period_registry": "0x4ee6ecad1c2dae9f525404de8555724e3c35d07b",
      "attestation_registry": "0xf4b146fba71f41e0592668ffbf264f1d186b2ca8"
    },
    "manifest_sha256": null,
    "validator_set_hash": "0xa47d27f6d6b0231de99fb6b587c266ef2ec50ba94a9976506c6ff98f9968b751"
  },
  "organisation": {
    "slug": "relecteur-exemple",
    "org_id": "0x15424c5b6d09deed88ad408275c50812e2c7cc9e142f746f936fc96b05d560fc"
  },
  "approvers": {
    "members": [
      "0x19d8bddeed23cb80dca47e16b74dd29bc020c138",
      "0x5747a77dda82031f8dd96a06a75c52a672a0a4c3",
      "0xdd2db1636768f86c546563f0368c5c8d5c777990"
    ],
    "threshold": 2,
    "set_admin": "0x436b0cee00aef664dd71949195231b609dbe1314"
  },
  "journals": [
    {
      "name": "journal-principal",
      "journal_id": "0x0e276f6ddd536cf34002bcf73a87e04f09c91ac66839399253a0a78ce9b0c64b"
    }
  ],
  "recorders": [
    {
      "key_id": "rec-exemple-01",
      "journal_id": "0x0e276f6ddd536cf34002bcf73a87e04f09c91ac66839399253a0a78ce9b0c64b",
      "algorithm": "ed25519",
      "public_key": "0xa34b5d38605d5b729c42eee01465e4e9f7a361c362561ebd8ec2f7c984463fbb",
      "custody_class": "D",
      "backend_type": "fichier",
      "created_at": "2026-11-01T08:40:00.000Z",
      "chain_key": "0xaf1056f6fd93594a0a71c87d3b18723232c61714",
      "chain_key_class": "D",
      "origin_proof": null
    }
  ],
  "funding": {
    "funder": "0xf39fd6e51aad88f6f4ce6ab8827279cfffb92266",
    "daily_budget_gas": 10800000,
    "amount_wei": "327000000"
  },
  "steps": [
    {
      "step": "jeu_approbateurs",
      "subject": "relecteur-exemple",
      "state": "capturee",
      "transaction_hash": "0x33a18d1e1bfd3159f60965659ae023244e61dabdafd71a9e9817f6e367c152a1",
      "block_number": 20000,
      "block_hash": "0x138aaa2e7ae431cf8b1428ffea83e6f385b9857970acd67d8dab3b3c6dcd2e78",
      "capture": "capture-20000-0-jeu_approbateurs.json",
      "error": null,
      "updated_at": "2026-11-01T08:45:04.000Z"
    },
    {
      "step": "assignation",
      "subject": "relecteur-exemple",
      "state": "a_faire",
      "transaction_hash": null,
      "block_number": null,
      "block_hash": null,
      "capture": null,
      "error": null,
      "updated_at": null
    },
    {
      "step": "lecture_jeu",
      "subject": "relecteur-exemple",
      "state": "a_faire",
      "transaction_hash": null,
      "block_number": null,
      "block_hash": null,
      "capture": null,
      "error": null,
      "updated_at": null
    },
    {
      "step": "approvisionnement",
      "subject": "0xaf1056f6fd93594a0a71c87d3b18723232c61714",
      "state": "a_faire",
      "transaction_hash": null,
      "block_number": null,
      "block_hash": null,
      "capture": null,
      "error": null,
      "updated_at": null
    },
    {
      "step": "inscription",
      "subject": "rec-exemple-01",
      "state": "a_faire",
      "transaction_hash": null,
      "block_number": null,
      "block_hash": null,
      "capture": null,
      "error": null,
      "updated_at": null
    },
    {
      "step": "premiere_ancre",
      "subject": "journal-principal",
      "state": "a_faire",
      "transaction_hash": null,
      "block_number": null,
      "block_hash": null,
      "capture": null,
      "error": null,
      "updated_at": null
    },
    {
      "step": "premiere_cloture",
      "subject": "journal-principal",
      "state": "a_faire",
      "transaction_hash": null,
      "block_number": null,
      "block_hash": null,
      "capture": null,
      "error": null,
      "updated_at": null
    }
  ],
  "result": null,
  "prepared_by": "relecteur de l'épreuve d'acceptation (exemple)",
  "prepared_at": "2026-11-01T08:41:00.000Z",
  "source": "exemple de CT-4 §7.10 : valeurs de transaction et de bloc synthétiques, SHA-256(UTF-8(\"noortrace/exemple/ct4/…\"))"
}
